{"ledger_status":"OPEN_APPEND_ONLY","notes":"Blank portable ledger. Record all known pre-existing exposures before freezing assignments, then append every packet exposure.","packet_id":"cv-packet-cv-sample-4a09a83f294e","pre_distribution_snapshot":{"captured_at":"2026-09-23T11:44:32+00:00","events":[]},"pre_distribution_snapshot_sha256":"sha256:73d56cca0da58db215929a3010c67f7408a0b87e5e3369155bd373d6d9ea1720","record_type":"construct_validation_source_exposure_ledger","review_events":[],"schema_version":"1.0.0","source_groups":[{"family_ids":["current.noaa01-r004-surf-av"],"source_group_id":"cand-049","source_ids":["cand-049"]},{"family_ids":["current.noaa01-r016-three-factors-vs"],"source_group_id":"cand-052","source_ids":["cand-052"]},{"family_ids":["future.ambient.factory.alarm","future.ambient.factory.alarm.second"],"source_group_id":"future-source-004","source_ids":["future-source-004"]},{"family_ids":["future.vsa.field.demonstration","future.vsa.field.demonstration.second"],"source_group_id":"future-source-005","source_ids":["future-source-005"]},{"family_ids":["future.v.museum.tour"],"source_group_id":"future-source-008","source_ids":["future-source-008"]},{"family_ids":["future.va.wildlife"],"source_group_id":"future-source-009","source_ids":["future-source-009"]}]}
