{"ledger_status":"OPEN_APPEND_ONLY","notes":"Task171 blank source-level exposure ledger. Before any later authorized rehearsal, add prescreener and author/verifier exposure as external_prior_work with preferred_evidence, then validate blind-role conflicts. No events are present in this task.","packet_id":"epic-dev-authoring-packets-v1","pre_distribution_snapshot":{"captured_at":"2026-10-02T00:00:00+08:00","events":[]},"pre_distribution_snapshot_sha256":"sha256:2c18324ae1210fd5259bca10fb34b4fed0b0f18e1318f47c0412cf0625a27de6","record_type":"construct_validation_source_exposure_ledger","review_events":[],"schema_version":"1.0.0","source_groups":[{"family_ids":["EPIC-DEV-P27-CLEANER-FROM-CUPBOARD","EPIC-DEV-P27-UNWRAP-FROZEN-ITEM"],"source_group_id":"P27","source_ids":["P27_101"]},{"family_ids":["EPIC-DEV-P28-ADD-ADJUST-STIR","EPIC-DEV-P28-DRY-HANDS-WITH-TOWEL","EPIC-DEV-P28-PEEL-POTATO"],"source_group_id":"P28","source_ids":["P28_103"]}]}
